### ISSUE TITLE
Access kube-apiserver via subdomain timeout

### ISSUE THREAD

**Issue by hokaxbt** [canonical/k8s-snap#1076]
### Summary

I can't access the `kube-apiserver` via subdomain `sub.mydomain.tld`

```shell
◎ kubectl get nodes      
E0215 15:23:45.407936    1749 memcache.go:265] "Unhandled Error" err="couldn't get current server API group list: Get \"https://xxx.hokaxbt.com:6443/api?timeout=32s\": EOF"
E0215 15:24:03.185843    1749 memcache.go:265] "Unhandled Error" err="couldn't get current server API group list: Get \"https://xxx.hokaxbt.com:6443/api?timeout=32s\": read tcp 192.168.1.30:50251->xxx:6443: read: connection reset by peer - error from a previous attempt: read tcp 192.168.1.30:50250->xxx:6443: read: connection reset by peer"
```

### What Should Happen Instead?

It should retuns list of nodes

```shell
root@control-plane-1:~# k8s kubectl get nodes -o wide
NAME              STATUS   ROLES                  AGE   VERSION   INTERNAL-IP   EXTERNAL-IP   OS-IMAGE             KERNEL-VERSION     CONTAINER-RUNTIME
control-plane-1   Ready    control-plane,worker   14h   v1.32.1   10.0.10.1     <none>        Ubuntu 24.04.2 LTS   6.8.0-53-generic   containerd://1.6.36
control-plane-2   Ready    control-plane,worker   14h   v1.32.1   10.0.10.2     <none>        Ubuntu 24.04.2 LTS   6.8.0-53-generic   containerd://1.6.36
control-plane-3   Ready    control-plane,worker   14h   v1.32.1   10.0.10.3     <none>        Ubuntu 24.04.2 LTS   6.8.0-53-generic   containerd://1.6.36
worker-1          Ready    worker                 14h   v1.32.1   10.0.20.1     <none>        Ubuntu 24.04.2 LTS   6.8.0-53-generic   containerd://1.6.36
```

### Reproduction Steps

Bootstrap the cluster using the following config:

```yaml
# bootstrap.yaml
cluster-config:
  network:
    enabled: true
  dns:
    enabled: true
    cluster-domain: cluster.local
    upstream-nameservers:
      - 1.1.1.1
      - 8.8.8.8
  ingress:
    enabled: false
  load-balancer:
    enabled: false
  local-storage:
    enabled: true
    default: true
  gateway:
    enabled: true
  metrics-server:
    enabled: true
  cloud-provider: external
disable-rbac: false
datastore-type: k8s-dqlite
extra-sans:
  - "xxx.hokaxbt.com"
  - "<load_balancer_public_ip>"
  - "<load_balancer_private_ip>"
extra-node-kubelet-args:
  --node-ip: "10.0.10.1"
```

Setup simple HAProxy on other server using the following config:

```
# /etc/haproxy/haproxy.cfg
#---------------------------------------------------------------------
# Global settings
#---------------------------------------------------------------------
global
    log stdout format raw local0
    daemon

    ssl-default-bind-ciphers ECDH+AESGCM:DH+AESGCM:ECDH+AES256:DH+AES256:ECDH+AES128:DH+AES:RSA+AESGCM:RSA+AES:!aNULL:!MD5:!DSS
    ssl-default-bind-options no-sslv3

#---------------------------------------------------------------------
# common defaults that all the 'listen' and 'backend' sections will
# use if not designated in their block
#---------------------------------------------------------------------
defaults
    mode    tcp
    log     global

    option  httplog
    option  dontlognull
    option  http-server-close
    option  forwardfor      except 127.0.0.0/8
    option  redispatch

    retries 1
    
    timeout http-request    10s
    timeout queue           20s
    timeout connect         5s
    timeout client          35s
    timeout server          35s
    timeout http-keep-alive 10s
    timeout check           10s

#---------------------------------------------------------------------
# apiserver frontend which proxys to the control plane nodes
#---------------------------------------------------------------------
frontend apiserver_frontend
    bind *:6443
    mode tcp
    option tcplog
    default_backend apiserver_backend

#---------------------------------------------------------------------
# round robin balancing for apiserver
#---------------------------------------------------------------------
backend apiserver_backend
    option httpchk

    http-check connect ssl
    http-check send meth GET uri /healthz
    http-check expect status 200

    mode tcp
    balance     roundrobin

    server control-plane-1 10.0.10.1:6443 check verify none
```

Point `sub.domain.tld` A record to load balancer ip address

---

I've double checked the following:

`kube-apiserver` listen to correct port:

```shell
root@control-plane-1:~# netstat -tulnp | grep kube-apiserv
tcp6       0      0 :::6443                 :::*                    LISTEN      366424/kube-apiserv 
```

load balancer server can reach the control plane server via `tcpdump`:

```shell
root@control-plane-1:~# tcpdump -i wg0 'port 6443'
tcpdump: verbose output suppressed, use -v[v]... for full protocol decode
listening on wg0, link-type RAW (Raw IP), snapshot length 262144 bytes
08:36:21.706719 IP 10.0.0.0.58492 > 10.0.10.1.6443: Flags [S], seq 618123953, win 64860, options [mss 1380,sackOK,TS val 2793896385 ecr 0,nop,wscale 7], length 0
08:36:21.706810 IP 10.0.10.1.6443 > 10.0.0.0.58492: Flags [S.], seq 1980722672, ack 618123954, win 64296, options [mss 1380,sackOK,TS val 813525111 ecr 2793896385,nop,wscale 7], length 0
08:36:21.707954 IP 10.0.0.0.58492 > 10.0.10.1.6443: Flags [P.], seq 1:518, ack 1, win 507, options [nop,nop,TS val 2793896386 ecr 813525111], length 517
08:36:21.708001 IP 10.0.10.1.6443 > 10.0.0.0.58492: Flags [.], ack 518, win 502, options [nop,nop,TS val 813525113 ecr 2793896386], length 0
08:36:21.708421 IP 10.0.10.1.6443 > 10.0.0.0.58492: Flags [P.], seq 1:370, ack 518, win 502, options [nop,nop,TS val 813525113 ecr 2793896386], length 369
08:36:21.709799 IP 10.0.0.0.58492 > 10.0.10.1.6443: Flags [P.], seq 518:582, ack 370, win 505, options [nop,nop,TS val 2793896388 ecr 813525113], length 64
08:36:21.709911 IP 10.0.0.0.58492 > 10.0.10.1.6443: Flags [P.], seq 582:629, ack 370, win 505, options [nop,nop,TS val 2793896388 ecr 813525113], length 47
08:36:21.709963 IP 10.0.10.1.6443 > 10.0.0.0.58492: Flags [.], ack 629, win 502, options [nop,nop,TS val 813525114 ecr 2793896388], length 0
08:36:21.710289 IP 10.0.10.1.6443 > 10.0.0.0.58492: Flags [P.], seq 370:722, ack 629, win 502, options [nop,nop,TS val 813525115 ecr 2793896388], length 352
08:36:21.710333 IP 10.0.10.1.6443 > 10.0.0.0.58492: Flags [FP.], seq 722:746, ack 629, win 502, options [nop,nop,TS val 813525115 ecr 2793896388], length 24
08:36:21.711493 IP 10.0.0.0.58492 > 10.0.10.1.6443: Flags [.], ack 747, win 503, options [nop,nop,TS val 2793896390 ecr 813525115], length 0
08:36:21.711519 IP 10.0.0.0.58492 > 10.0.10.1.6443: Flags [P.], seq 629:653, ack 747, win 503, options [nop,nop,TS val 2793896390 ecr 813525115], length 24
08:36:21.711531 IP 10.0.10.1.6443 > 10.0.0.0.58492: Flags [R], seq 1980723419, win 0, length 0
08:36:21.711585 IP 10.0.0.0.58492 > 10.0.10.1.6443: Flags [F.], seq 653, ack 747, win 503, options [nop,nop,TS val 2793896390 ecr 813525115], length 0
08:36:21.711625 IP 10.0.10.1.6443 > 10.0.0.0.58492: Flags [R], seq 1980723419, win 0, length 0
08:36:23.714543 IP 10.0.0.0.58506 > 10.0.10.1.6443: Flags [S], seq 3867270227, win 64860, options [mss 1380,sackOK,TS val 2793898393 ecr 0,nop,wscale 7], length 0
08:36:23.714606 IP 10.0.10.1.6443 > 10.0.0.0.58506: Flags [S.], seq 393984800, ack 3867270228, win 64296, options [mss 1380,sackOK,TS val 813527119 ecr 2793898393,nop,wscale 7], length 0
```

I've checked the certificate, it contains the correct dns:

```shell
root@control-plane-1:~# openssl x509 -in /etc/kubernetes/pki/apiserver.crt -noout -text | grep -A 1 "Subject Alternative Name"
            X509v3 Subject Alternative Name: 
                DNS:xxx.hokaxbt.com, DNS:kubernetes, DNS:kubernetes.default, DNS:kubernetes.default.svc, DNS:kubernetes.default.svc.cluster, DNS:kubernetes.default.svc.cluster.local, IP Address:10.0.10.1, IP Address:10.152.183.1, IP Address:127.0.0.1, IP Address:xxx, IP Address:10.0.10.1, IP Address:192.168.0.0, IP Address:192.168.0.1, IP Address:0:0:0:0:0:0:0:1, IP Address:FE80:0:0:0:58C8:A1FF:FECD:ED9, IP Address:FE80:0:0:0:6CEA:4EFF:FE1C:DEC6, IP Address:FE80:0:0:0:6851:5EFF:FE4E:C2AA
```

I've double checked the firewall:

```
root@load-balancer-1:~# ufw status | grep 6443
6443/tcp                   ALLOW       Anywhere                  
6443/tcp (v6)              ALLOW       Anywhere (v6)  
```

### System information

I want to attach the tarball but it shows an error of leaking sensitive data

```shell
Collecting service information
Running inspection on a control-plane node
 INFO:  Service k8s.containerd is running
 INFO:  Service k8s.kube-proxy is running
 INFO:  Service k8s.k8s-dqlite is running
 INFO:  Service k8s.k8sd is running
 INFO:  Service k8s.kube-apiserver is running
 INFO:  Service k8s.kube-controller-manager is running
 INFO:  Service k8s.kube-scheduler is running
 INFO:  Service k8s.kubelet is running
Collecting registry mirror logs
Collecting service arguments
 INFO:  Copy service args to the final report tarball
Collecting k8s cluster-info
 INFO:  Copy k8s cluster-info dump to the final report tarball
Collecting SBOM
 INFO:  Copy SBOM to the final report tarball
Collecting system information
 INFO:  Copy uname to the final report tarball
 INFO:  Copy snap diagnostics to the final report tarball
 INFO:  Copy k8s diagnostics to the final report tarball
Collecting networking information
 INFO:  Copy network diagnostics to the final report tarball
 WARNING:  Unexpected private key or certificate found in the report:
 WARNING:  Found in the following files: inspection-report/k8s.kubelet/journal.log,inspection-report/snap-logs-k8s.log,inspection-report/k8s.kube-apiserver/journal.log
 WARNING:  Please remove the private key or certificate from the report before sharing.
Building the report tarball
 SUCCESS:  Report tarball is at /root/inspection-report-20250215_083731.tar.gz
```

### Can you suggest a fix?

I'm sure this is not bug, what error on my side. Just wanted to confirm is this correct way to access the cluster via my local machine:

```
scp control-plane-1:/etc/kubernetes/admin.conf $HOME/.kube/config
sudo chown $(id -u):$(id -g) $HOME/.kube/config
```

Then replace the localhost endpoint to my subdomain

**Comment by louiseschmidtgen** [comment]
Hi @hokaxbt,

Thanks for filing your issue! Could you please upload the inspection report that you've created at `/root/inspection-report-20250215_083731.tar.gz`?

Best regards,
Louise

**Comment by hokaxbt** [comment]
@louiseschmidtgen sorry, I've destroyed my cluster. I will close this issue
