### ISSUE TITLE
Pods cannot acces the cluster ip api endpoints when a control plane is being deleted

### ISSUE THREAD

**Issue by ader1990** [canonical/k8s-snap#1966]
### Summary

Context: deploy a 3 CP cluster and then downscale to 2 CPs.

State of the cluster nodes:

```
kubectl get node -A
NAME                                               STATUS   ROLES                  AGE   VERSION
management-cluster-cp-66917a714d-ctvfq.novalocal   Ready    control-plane,worker   63m   v1.32.9 -> IP 10.5.0.162
management-cluster-cp-66917a714d-dthjq.novalocal   Ready    control-plane,worker   57m   v1.32.9
```

This node has been already deleted from the kubernetes cluster but it is still alive in a cleaned k8s state - if I run k8s status on that machine, it says `not bootstrapped`:

```
management-cluster-cp-66917a714d-bpmd8 with  IP 10.5.0.92
```

There is a pod `cacpck-system/cacpck-controller-manager-7b8699cc89-2w2cq` on node `management-cluster-cp-66917a714d-dthjq.novalocal` with `cni-ee59b783-e755-a846-125a-3ff380df06bc` netns.

Its logs:

```
 E1028 19:59:42.138175       1 leaderelection.go:436] error retrieving resource lock cacpck-system/148fa072.controlplane.cluster.x-k8s.io: Get "https://100.73.0.1:443/apis/co │
│ ordination.k8s.io/v1/namespaces/cacpck-system/leases/148fa072.controlplane.cluster.x-k8s.io?timeout=5s": context deadline exceeded                                            │
│ E1028 19:59:51.310428       1 leaderelection.go:436] error retrieving resource lock cacpck-system/148fa072.controlplane.cluster.x-k8s.io: the server was unable to return a r │
│ esponse in the time allotted, but may still be processing the request (get leases.coordination.k8s.io 148fa072.controlplane.cluster.x-k8s.io)                                 │
│ E1028 19:59:59.745628       1 leaderelection.go:436] error retrieving resource lock cacpck-system/148fa072.controlplane.cluster.x-k8s.io: Get "https://100.73.0.1:443/apis/co │
│ ordination.k8s.io/v1/namespaces/cacpck-system/leases/148fa072.controlplane.cluster.x-k8s.io?timeout=5s": context deadline exceeded                                            │
│ E1028 20:00:08.290628       1 leaderelection.go:436] error retrieving resource lock cacpck-system/148fa072.controlplane.cluster.x-k8s.io: Get "https://100.73.0.1:443/apis/co │
│ ordination.k8s.io/v1/namespaces/cacpck-system/leases/148fa072.controlplane.cluster.x-k8s.io?timeout=5s": context deadline exceeded                                            │
│ E1028 20:00:16.347393       1 leaderelection.go:436] error retrieving resource lock cacpck-system/148fa072.controlplane.cluster.x-k8s.io: Get "https://100.73.0.1:443/apis/co │
│ ordination.k8s.io/v1/namespaces/cacpck-system/leases/148fa072.controlplane.cluster.x-k8s.io?timeout=5s": context deadline exceeded                                            │
│ E1028 20:00:24.839586       1 leaderelection.go:436] error retrieving resource lock cacpck-system/148fa072.controlplane.cluster.x-k8s.io: Get "https://100.73.0.1:443/apis/co │
│ ordination.k8s.io/v1/namespaces/cacpck-system/leases/148fa072.controlplane.cluster.x-k8s.io?timeout=5s": net/http: request canceled (Client.Timeout exceeded while awaiting h │
│ eaders)                                                                                                                                                                       │
│ E1028 20:00:33.453027       1 leaderelection.go:436] error retrieving resource lock cacpck-system/148fa072.controlplane.cluster.x-k8s.io: Get "https://100.73.0.1:443/apis/co │
│ ordination.k8s.io/v1/namespaces/cacpck-system/leases/148fa072.controlplane.cluster.x-k8s.io?timeout=5s": context deadline exceeded                                            │
│ E1028 20:00:41.506275       1 leaderelection.go:436] error retrieving resource lock cacpck-system/148fa072.controlplane.cluster.x-k8s.io: the server was unable to return a r │
│ esponse in the time allotted, but may still be processing the request (get leases.coordination.k8s.io 148fa072.controlplane.cluster.x-k8s.io)                                 │
│ E1028 20:00:48.864791       1 leaderelection.go:436] error retrieving resource lock cacpck-system/148fa072.controlplane.cluster.x-k8s.io: Get "https://100.73.0.1:443/apis/co │
│ ordination.k8s.io/v1/namespaces/cacpck-system/leases/148fa072.controlplane.cluster.x-k8s.io?timeout=5s": context deadline exceeded                                            │
│ E1028 20:00:58.208634       1 leaderelection.go:436] error retrieving resource lock cacpck-system/148fa072.controlplane.cluster.x-k8s.io: Get "https://100.73.0.1:443/apis/co │
│ ordination.k8s.io/v1/namespaces/cacpck-system/leases/148fa072.controlplane.cluster.x-k8s.io?timeout=5s": context deadline exceeded                                            │
│ E1028 20:01:07.002065       1 leaderelection.go:436] error retrieving resource lock cacpck-system/148fa072.controlplane.cluster.x-k8s.io: Get "https://100.73.0.1:443/apis/co │
│ ordination.k8s.io/v1/namespaces/cacpck-system/leases/148fa072.controlplane.cluster.x-k8s.io?timeout=5s": context deadline exceeded                                            │
│ E1028 20:01:14.319324       1 leaderelection.go:436] error retrieving resource lock cacpck-system/148fa072.controlplane.cluster.x-k8s.io: Get "https://100.73.0.1:443/apis/co │
│ ordination.k8s.io/v1/namespaces/cacpck-system/leases/148fa072.controlplane.cluster.x-k8s.io?timeout=5s": context deadline exceeded                                            │
│ E1028 20:01:21.886824       1 leaderelection.go:436] error retrieving resource lock cacpck-system/148fa072.controlplane.cluster.x-k8s.io: Get "https://100.73.0.1:443/apis/co │
│ ordination.k8s.io/v1/namespaces/cacpck-system/leases/148fa072.controlplane.cluster.x-k8s.io?timeout=5s": net/http: request canceled (Client.Timeout exceeded while awaiting h │
│ eaders)                                                                                                                                                                       │
│ E1028 20:01:29.490098       1 leaderelection.go:436] error retrieving resource lock cacpck-system/148fa072.controlplane.cluster.x-k8s.io: Get "https://100.73.0.1:443/apis/co │
│ ordination.k8s.io/v1/namespaces/cacpck-system/leases/148fa072.controlplane.cluster.x-k8s.io?timeout=5s": net/http: request canceled (Client.Timeout exceeded while awaiting h │
│ eaders)                                                                                                                                                                       │
│ E1028 20:01:36.945724       1 leaderelection.go:436] error retrieving resource lock cacpck-system/148fa072.controlplane.cluster.x-k8s.io: the server was unable to return a r │
│ esponse in the time allotted, but may still be processing the request (get leases.coordination.k8s.io 148fa072.controlplane.cluster.x-k8s.io)                                 │
│ E1028 20:01:44.359679       1 leaderelection.go:436] error retrieving resource lock cacpck-system/148fa072.controlplane.cluster.x-k8s.io: the server was unable to return a r │
│ esponse in the time allotted, but may still be processing the request (get leases.coordination.k8s.io 148fa072.controlplane.cluster.x-k8s.io) 
```

When I run tcpdump on the netns:

```
root@management-cluster-cp-66917a714d-dthjq:~# ip netns exec cni-ee59b783-e755-a846-125a-3ff380df06bc tcpdump -i eth0 -A
tcpdump: verbose output suppressed, use -v[v]... for full protocol decode
listening on eth0, link-type EN10MB (Ethernet), snapshot length 262144 bytes
^C19:57:57.543386 IP 100.72.1.78.52382 > 10.5.0.92.6443: Flags [P.], seq 1794788677:1794788712, ack 381115063, win 1368, options [nop,nop,TS val 3258659419 ecr 2391778632], length 35
E..W..@.@...dH.N
..\...+j.ME..Z....Xp@.....
.;2[...H.....W..R..)Q....M9..J....u.....K{.
19:57:57.544103 IP 10.5.0.92.6443 > 100.72.1.78.52382: Flags [.], ack 35, win 482, options [nop,nop,TS val 2391783591 ecr 3258659419], length 0
E..4.V@.>..v
..\dH.N.+....Z.j.Mh....p......
.....;2[
```

But if I stop the underlying rogue VM manually:

```
20:03:36.105168 IP 100.72.1.78.53084 > 10.5.0.162.6443: Flags [P.], seq 347:382, ack 7264, win 416, options [nop,nop,TS val 1502888064 ecr 2652593688], length 35
E..WA.@.@..SdH.N
....\.+e$.p.{.N....p......
Y.@...^..........'.........!*..m.....u..SS.
20:03:36.146137 IP 10.5.0.162.6443 > 100.72.1.78.53084: Flags [.], ack 382, win 489, options [nop,nop,TS val 2652593730 ecr 1502888064], length 0
E..4V.@.>.u.
...dH.N.+.\.{.Ne$......pc.....
..^BY.@.
20:03:39.553288 IP 100.72.1.78.53084 > 10.5.0.162.6443: Flags [P.], seq 382:421, ack 7264, win 416, options [nop,nop,TS val 1502891512 ecr 2652593730], length 39
E..[A.@.@..NdH.N
....\.+e$...{.N....p......
Y.M...^B...."?E..U.3.8xH..U...>....p....Vq.W...
20:03:39.553736 IP 10.5.0.162.6443 > 100.72.1.78.53084: Flags [.], ack 421, win 489, options [nop,nop,TS val 2652597137 ecr 1502891512], length 0
E..4V.@.>.u.
...dH.N.+.\.{.Ne$......pc.....
..k.Y.M.
20:03:39.557153 IP 10.5.0.162.6443 > 100.72.1.78.53084: Flags [P.], seq 7264:7354, ack 421, win 489, options [nop,nop,TS val 2652597141 ecr 1502891512], length 90
E...V.@.>.u.
...dH.N.+.\.{.Ne$......p......
..k.Y.M.....U.Q....l..........H8...?'&UG.........``]..).(&...v.K}.|...DZ.wJv.K..n.J....1../.i1.aZ.
20:03:39.557189 IP 10.5.0.162.6443 > 100.72.1.78.53084: Flags [P.], seq 7354:8172, ack 421, win 489, options [nop,nop,TS val 2652597141 ecr 1502891512], length 818
E..fV
```

Note that the 100.73.0.1 requests get redirected to a valid node: 10.5.0.162 which is management-cluster-cp-66917a714d-ctvfq.novalocal.

Conclusion:

Some pods can get stuck in leader election or any kind of API request that needs a response from the clusterIP apis endpoint, as the underlying mac adress of the clusterIP is the one of the to-be deleted node, and that node might have been already cleaned up from the k8s perspective.

The problem seems to be that the underlying k8s-snap implementation sees that the node still responds to arp / ping requests and considers it as a valid endpoint of the kube-api server?

### What Should Happen Instead?

100.73.0.1 (clusterIP) -> should instantly be pointing to the healthy nodes from the cluster.

### Reproduction Steps

deploy k8s-snap using capi / Sylva.

### System information

TBD.

**Comment by addyess** [comment]
please if you could provide the output of 

```sh
k8s inspect
```

from the supplied nodes?

**Comment by ader1990** [comment]
> please if you could provide the output of
> 
> k8s inspect
> from the supplied nodes?

Working now to recreate the environment and reproduce the issue. Note that this issue cannot be reproduced every time and the actual deployment is using metal3 or openstack infra providers with capi, in the broader context of https://sylva-projects.gitlab.io/. Sylva deployments are quite complex and involve Longhorn or OpenStack Cinder CSI, kube-vip, maxSurge=0 in the context of rolling upgrades and more.

The issue is that some pods that need acces to the kubernetes clusterIP to query for leases or other resources have those http requests to the clusterIP internally redirected to the so called ghost nodes IPs presented better in this issue here: https://github.com/canonical/cluster-api-k8s/issues/183#issuecomment-3425036853.

The information produced by `k8s inspect` might be useful or not, as the actual issue hypothesis 
can only be confirmed by running tcpdump on the cni network namespace. Will come back with the k8s inspect tar.gz, after I verify that it does contain information that can be shared publicly.

This issue appears with 1.32.9 k8s-snap + etcd and was tested to happen when deploying with cilium or calico CNIs.

Thanks.
